{
  "crawlKey": "https://example.com/feed.xml",
  "name": "Example Feed",
  "type": "rss",
  "url": "https://example.com/feed.xml",
  "active": true,
  "sourceStatus": "ready",
  "configurationStatus": null,
  "sourceHealthStatus": "blocked",
  "sourceHealthReason": "http_403",
  "sourceHealth": {
    "status": "blocked",
    "reason": "http_403",
    "operator_attention": true,
    "operator_attention_reason": "http_403",
    "crawl": {
      "last_status": "success",
      "candidate_count": 10,
      "skipped_count": 8,
      "processed_count": 0,
      "unchanged_count": 2,
      "fetch_error_count": 0,
      "llm_failed_count": 0,
      "consecutive_error_count": 0
    },
    "policy": {
      "next_allowed_crawl_at": "2026-05-10T13:20:00+00:00",
      "detected": {
        "http_status": 403
      }
    }
  },
  "operatorAttention": true,
  "operatorAttentionReason": "http_403",
  "lastDispatchReason": "due",
  "lastCrawlStatus": "success",
  "lastCrawlStartedAt": "2026-05-10T10:15:00+00:00",
  "lastCrawlFinishedAt": "2026-05-10T10:20:00+00:00",
  "lastSuccessfulCrawlAt": "2026-05-10T10:20:00+00:00",
  "lastCrawlError": null,
  "nextAllowedCrawlAt": "2026-05-10T13:20:00+00:00",
  "crawlTotalCount": 10,
  "crawlCandidateCount": 10,
  "crawlSkippedCount": 8,
  "crawlProcessedCount": 0,
  "crawlFetchErrorCount": 0,
  "crawlUnchangedCount": 2,
  "crawlLlmFailedCount": 0,
  "consecutiveErrorCount": 0,
  "lastCrawlResult": {
    "total_count": 10,
    "candidate_count": 10,
    "skipped_count": 8,
    "processed_count": 0,
    "fetch_error_count": 0,
    "unchanged_count": 2,
    "llm_failed_count": 0
  },
  "effectivePolicy": {
    "crawl_interval_minutes": 180,
    "refresh_window_days": 7,
    "max_llm_items_per_run": 3
  },
  "detectedPolicy": {
    "http_status": 403
  },
  "detectedPolicyCheckedAt": "2026-05-10T10:14:30+00:00",
  "detectedPolicyError": null
}
