{
  "crawlKey": "https://example.com/feed.xml",
  "name": "Example Feed",
  "type": "rss",
  "url": "https://example.com/feed.xml",
  "active": true,
  "sourceStatus": "ready",
  "configurationStatus": null,
  "sourceHealthStatus": "degraded",
  "sourceHealthReason": "last_crawl_partial_failed",
  "sourceHealth": {
    "status": "degraded",
    "reason": "last_crawl_partial_failed",
    "operator_attention": true,
    "operator_attention_reason": "fetch_errors_without_processed_items",
    "crawl": {
      "last_status": "partial_failed",
      "candidate_count": 10,
      "skipped_count": 5,
      "processed_count": 0,
      "unchanged_count": 2,
      "fetch_error_count": 3,
      "llm_failed_count": 0,
      "consecutive_error_count": 1
    },
    "policy": {
      "next_allowed_crawl_at": "2026-05-10T11:20:00+00:00",
      "detected": {
        "http_status": 200
      }
    }
  },
  "operatorAttention": true,
  "operatorAttentionReason": "fetch_errors_without_processed_items",
  "lastDispatchReason": "due",
  "lastCrawlStatus": "partial_failed",
  "lastCrawlStartedAt": "2026-05-10T10:15:00+00:00",
  "lastCrawlFinishedAt": "2026-05-10T10:20:00+00:00",
  "lastSuccessfulCrawlAt": "2026-05-09T10:20:00+00:00",
  "lastCrawlError": "3 fetch error(s)",
  "nextAllowedCrawlAt": "2026-05-10T11:20:00+00:00",
  "crawlTotalCount": 10,
  "crawlCandidateCount": 10,
  "crawlSkippedCount": 5,
  "crawlProcessedCount": 0,
  "crawlFetchErrorCount": 3,
  "crawlUnchangedCount": 2,
  "crawlLlmFailedCount": 0,
  "consecutiveErrorCount": 1,
  "lastCrawlResult": {
    "total_count": 10,
    "candidate_count": 10,
    "skipped_count": 5,
    "processed_count": 0,
    "fetch_error_count": 3,
    "unchanged_count": 2,
    "llm_failed_count": 0
  },
  "effectivePolicy": {
    "crawl_interval_minutes": 60,
    "refresh_window_days": 7,
    "max_llm_items_per_run": 3
  },
  "detectedPolicy": {
    "http_status": 200
  },
  "detectedPolicyCheckedAt": "2026-05-10T10:14:30+00:00",
  "detectedPolicyError": null
}
